{
  "$schema": "assessment-reconciliation-contract.schema.json",
  "schemaVersion": 1,
  "contractId": "assessment-reconciliation-v4",
  "behaviorFiles": [
    "hosted_copilot/copilot-rule-catalog/assessment-reconciliation/assessment-reconciliation-contract.schema.json",
    "hosted_copilot/copilot-rule-catalog/assessment-reconciliation/assessment-reconciliation-consolidation.schema.json",
    "hosted_copilot/copilot-rule-catalog/assessment-reconciliation/assessment-reconciliation-draft.schema.json",
    "hosted_copilot/copilot-rule-catalog/assessment-reconciliation/assessment-reconciliation-routing.schema.json",
    "hosted_copilot/copilot-rule-catalog/assessment-reconciliation/hierarchical-reconciliation-cache.schema.json",
    "hosted_copilot/copilot-rule-catalog/assessment-reconciliation/hierarchical-reconciliation-run.schema.json",
    "hosted_copilot/copilot-rule-catalog/assessment-reconciliation/workbench-display-v4.schema.json",
    "hosted_copilot/copilot-rule-catalog/guidance-capacity.schema.json",
    "hosted_copilot/copilot-rule-catalog/instruction-catalog.schema.json",
    "hosted_copilot/copilot-rule-catalog/rule-assessments/source-assessment-baseline-v4.schema.json",
    "hosted_copilot/copilot-rule-catalog/source-definitions/source-definition-set.json",
    "hosted_copilot/copilot-rule-catalog/source-definitions/source-definition-set.schema.json",
    "hosted_copilot/copilot-rule-catalog/source-inventories/source-inventory.schema.json",
    "hosted_copilot/tools/assessment-reconciliation-prompts/AssessmentReconciliationConsolidation-v4.md",
    "hosted_copilot/tools/assessment-reconciliation-prompts/AssessmentReconciliationRouting-v4.md",
    "hosted_copilot/tools/assessment-reconciliation-prompts/AssessmentReconciliation-v4.md",
    "hosted_copilot/tools/modules/reconciliation/HierarchicalReconciliation.psm1",
    "hosted_copilot/tools/modules/reconciliation/HierarchicalReconciliationPipeline.psm1",
    "hosted_copilot/tools/modules/reconciliation/HierarchicalReconciliationState.psm1",
    "hosted_copilot/tools/internal/reconciliation/Invoke-CopilotReconciliationStage.ps1",
    "hosted_copilot/tools/internal/reconciliation/Invoke-AssessmentReconciliation.ps1",
    "hosted_copilot/tools/internal/reconciliation/New-WorkbenchDisplay.ps1",
    "hosted_copilot/tools/modules/reconciliation/ReconciliationStageExecutor.psm1",
    "hosted_copilot/tools/modules/shared/HostedToolkit.Helpers.psm1",
    "hosted_copilot/tools/modules/shared/SourceEvidenceValidation.psm1"
  ],
  "presentationFiles": [
    "hosted_copilot/tools/modules/reconciliation/ReconciliationStagePresentation.psm1"
  ],
  "idAllocation": {
    "numericWidth": 3,
    "families": [
      { "category": "documentation", "placement": "Argument Accuracy", "idFamily": "DOCS-ARG" },
      { "category": "documentation", "placement": "Argument Accuracy", "idFamily": "DOCS-FMT" },
      { "category": "documentation", "placement": "Argument Accuracy", "idFamily": "DOCS-NOTE" },
      { "category": "documentation", "placement": "Evidence And Coverage", "idFamily": "DOCS-ARG" },
      { "category": "documentation", "placement": "Evidence And Coverage", "idFamily": "DOCS-ATTR" },
      { "category": "documentation", "placement": "Evidence And Coverage", "idFamily": "DOCS-EVID" },
      { "category": "documentation", "placement": "Examples And Imports", "idFamily": "DOCS-EX" },
      { "category": "documentation", "placement": "Examples And Imports", "idFamily": "DOCS-IMP" },
      { "category": "documentation", "placement": "Frontmatter And Structure", "idFamily": "DOCS-FM" },
      { "category": "documentation", "placement": "Frontmatter And Structure", "idFamily": "DOCS-FMT" },
      { "category": "documentation", "placement": "Frontmatter And Structure", "idFamily": "DOCS-STRUCT" },
      { "category": "documentation", "placement": "Wording", "idFamily": "DOCS-WORD" },
      { "category": "implementation", "placement": "Azure Update Semantics", "idFamily": "IMPL-PATCH" },
      { "category": "implementation", "placement": "Create And Import Behavior", "idFamily": "IMPL-WF" },
      { "category": "implementation", "placement": "Errors", "idFamily": "IMPL-ERR" },
      { "category": "implementation", "placement": "Evidence And Resource Type", "idFamily": "IMPL-EVID" },
      { "category": "implementation", "placement": "Evidence And Resource Type", "idFamily": "IMPL-WF" },
      { "category": "implementation", "placement": "Schema And State", "idFamily": "IMPL-SCHEMA" },
      { "category": "testing", "placement": "Assertions And Validation", "idFamily": "TEST-PATTERN" },
      { "category": "testing", "placement": "Evidence And Lifecycle", "idFamily": "TEST-EVID" },
      { "category": "testing", "placement": "Evidence And Lifecycle", "idFamily": "TEST-WF" },
      { "category": "testing", "placement": "Feature Branches And Azure Setup", "idFamily": "TEST-PATTERN" },
      { "category": "testing", "placement": "Generated And Embedded Content", "idFamily": "TEST-PATTERN" }
    ]
  }
}
